{
  "schema_version": 1,
  "case_id": "composed-ten-vs-big-equivalence",
  "k_sq": 9,
  "carry_width": 3,
  "source_atoms": ["p0"],
  "atoms": [
    { "id": "p0", "r": 2 },
    { "id": "p1", "r": 5 },
    { "id": "p2", "r": 8 },
    { "id": "p3", "r": 10 },
    { "id": "p4", "r": 13 },
    { "id": "p5", "r": 15 },
    { "id": "p6", "r": 18 },
    { "id": "p7", "r": 20 },
    { "id": "p8", "r": 23 },
    { "id": "p9", "r": 25 },
    { "id": "p10", "r": 28 },
    { "id": "p11", "r": 30 },
    { "id": "p12", "r": 33 },
    { "id": "p13", "r": 35 },
    { "id": "p14", "r": 38 },
    { "id": "p15", "r": 40 },
    { "id": "p16", "r": 43 },
    { "id": "p17", "r": 45 },
    { "id": "p18", "r": 48 },
    { "id": "p19", "r": 50 },
    { "id": "q0", "r": 23 },
    { "id": "q1", "r": 25 },
    { "id": "q2", "r": 28 },
    { "id": "q3", "r": 30 },
    { "id": "q4", "r": 33 }
  ],
  "edges": [
    { "a": "p0", "b": "p1" },
    { "a": "p1", "b": "p2" },
    { "a": "p2", "b": "p3" },
    { "a": "p3", "b": "p4" },
    { "a": "p4", "b": "p5" },
    { "a": "p5", "b": "p6" },
    { "a": "p6", "b": "p7" },
    { "a": "p7", "b": "p8" },
    { "a": "p8", "b": "p9" },
    { "a": "p9", "b": "p10" },
    { "a": "p10", "b": "p11" },
    { "a": "p11", "b": "p12" },
    { "a": "p12", "b": "p13" },
    { "a": "p13", "b": "p14" },
    { "a": "p14", "b": "p15" },
    { "a": "p15", "b": "p16" },
    { "a": "p16", "b": "p17" },
    { "a": "p17", "b": "p18" },
    { "a": "p18", "b": "p19" },
    { "a": "q0", "b": "q1" },
    { "a": "q1", "b": "q2" },
    { "a": "q2", "b": "q3" },
    { "a": "q3", "b": "q4" }
  ],
  "bands": [
    { "id": "b0", "r_inner": 0, "r_outer": 5 },
    { "id": "b1", "r_inner": 5, "r_outer": 10 },
    { "id": "b2", "r_inner": 10, "r_outer": 15 },
    { "id": "b3", "r_inner": 15, "r_outer": 20 },
    { "id": "b4", "r_inner": 20, "r_outer": 25 },
    { "id": "b5", "r_inner": 25, "r_outer": 30 },
    { "id": "b6", "r_inner": 30, "r_outer": 35 },
    { "id": "b7", "r_inner": 35, "r_outer": 40 },
    { "id": "b8", "r_inner": 40, "r_outer": 45 },
    { "id": "b9", "r_inner": 45, "r_outer": 50 }
  ],
  "guards": ["composed_equals_big", "composed_band_count_guard"],
  "overflow_counters": {
    "component_label_overflow": 0,
    "carry_atom_overflow": 0
  },
  "notes": "Ten stitched bands must produce the same separator partition and source bits as one large prefix."
}
