{
  "schema_version": 1,
  "case_id": "non-source-partition-merge",
  "k_sq": 9,
  "carry_width": 3,
  "source_atoms": ["s"],
  "atoms": [
    { "id": "s", "r": 7 },
    { "id": "a", "r": 9 },
    { "id": "b", "r": 9 },
    { "id": "c", "r": 9 },
    { "id": "t", "r": 12 }
  ],
  "edges": [
    { "a": "s", "b": "a" },
    { "a": "b", "b": "c" },
    { "a": "a", "b": "b", "band": "b1" },
    { "a": "c", "b": "t", "band": "b1" }
  ],
  "bands": [
    { "id": "b0", "r_inner": 0, "r_outer": 10 },
    { "id": "b1", "r_inner": 10, "r_outer": 14 }
  ],
  "guards": ["composed_equals_big", "drop_non_source_carry_guard"],
  "overflow_counters": {
    "component_label_overflow": 0,
    "carry_atom_overflow": 0
  },
  "notes": "The b-c carry class is initially non-source, then b merges into source and c reaches t. Dropping non-source carry loses the valid later source path."
}
