{
  "schema_version": 1,
  "case_id": "terminal-death-inventory",
  "k_sq": 9,
  "carry_width": 3,
  "source_atoms": ["s"],
  "atoms": [
    { "id": "s", "r": 5 },
    { "id": "a", "r": 7 },
    { "id": "far", "r": 8 },
    { "id": "q", "r": 20 }
  ],
  "edges": [
    { "a": "s", "b": "a" },
    { "a": "a", "b": "far" }
  ],
  "bands": [
    { "id": "b0", "r_inner": 0, "r_outer": 10 },
    { "id": "b1", "r_inner": 10, "r_outer": 20 }
  ],
  "guards": ["terminal_death_guard"],
  "overflow_counters": {
    "component_label_overflow": 0,
    "carry_atom_overflow": 0
  },
  "expected_terminal_inventory": ["a", "far", "s"],
  "notes": "The final guard contains only neutral q. The source terminal certificate must retain the retired source inventory."
}
